name,price,images,Key Ingredients,Size
The Peptide Collagen Hydrogel Eye Patch,$23.00,"https://www.cosrx.com/cdn/shop/files/Peptide-eye-patch2___800x1067-_-_-jpg_800x.webp?v=1768284034,https://www.cosrx.com/cdn/shop/files/Peptide-eye-patch2___800x1067-_-_-jpg.webp?v=1768284034&width=480,https://www.cosrx.com/cdn/shop/files/Hydrogel_Eye_patch_1_1024x1024.jpg?v=1768284034,https://www.cosrx.com/cdn/shop/files/Hydrogel_Eye_patch_2_1024x1024.jpg?v=1768284034,https://www.cosrx.com/cdn/shop/files/Hydrogel_Eye_patch_3_1024x1024.jpg?v=1768284034,https://www.cosrx.com/cdn/shop/files/Hydrogel_Eye_patch_4_1024x1024.jpg?v=1768284034,https://www.cosrx.com/cdn/shop/files/Hydrogel_Eye_patch_5_1024x1024.jpg?v=1768284034,https://www.cosrx.com/cdn/shop/files/Hydrogel_Eye_patch_7_1024x1024.jpg?v=1768284034,https://www.cosrx.com/cdn/shop/files/Hydrogel_Eye_patch_8_1024x1024.jpg?v=1768284034,https://www.cosrx.com/cdn/shop/files/Hydrogel_Eye_patch_9__2_1024x1024.jpg?v=1768284034,https://www.cosrx.com/cdn/shop/files/Hydrogel_Eye_patch_11_1024x1024.jpg?v=1768284034,https://www.cosrx.com/cdn/shop/files/Hydrogel_Eye_patch_14__2_1_1024x1024.jpg?v=1768284034,https://www.cosrx.com/cdn/shop/files/Hydrogel_Eye_patch_15_1024x1024.jpg?v=1768284034,https://www.cosrx.com/cdn/shop/files/Hydrogel_Eye_patch_16_1024x1024.jpg?v=1768284034,https://www.cosrx.com/cdn/shop/files/Hydrogel_Eye_patch_17_1024x1024.jpg?v=1768284034,https://www.cosrx.com/cdn/shop/files/Hydrogel-Eye-patch3_800x1067_e01612cc-f037-4535-8587-9a0d68d4f857_1024x1024.png?v=1768284034,https://www.cosrx.com/cdn/shop/files/peptide_patch_promo_1_1024x1024.png?v=1763629989,https://www.cosrx.com/cdn/shop/files/600x750_MO__01_300x.jpg?v=1754049528","4 Types of Peptides, Low Molecular Collagen, Vitamin B12, Caffeine, Hyaluronic Acid, Niacinamide / Adenosine",85g
COSRX The Blue Peptide Bakuchiol Plump Glow Serum,$27.00,"https://www.cosrx.com/cdn/shop/files/BluePeptide_Serum_00_800x.jpg?v=1777444989,https://www.cosrx.com/cdn/shop/files/BluePeptide_Serum_00.jpg?v=1777444989&width=480,https://www.cosrx.com/cdn/shop/files/BluePeptide_Serum_01_e12a9b68-8aca-4628-ba86-9b46beef3f49_1024x1024.jpg?v=1781770967,https://www.cosrx.com/cdn/shop/files/BluePeptide__-_1_a80f0d8b-adf4-41db-b8cc-3d285079be19_1024x1024.jpg?v=1780659432,https://www.cosrx.com/cdn/shop/files/BluePeptide_Serum_02__3_1024x1024.webp?v=1777521461,https://www.cosrx.com/cdn/shop/files/BluePeptide_Serum_03_1024x1024.webp?v=1777521461,https://www.cosrx.com/cdn/shop/files/BluePeptide_Serum_05_1024x1024.webp?v=1777521461,https://www.cosrx.com/cdn/shop/files/BluePeptide_Serum_06_881b3d87-cdda-4aa9-bc5d-083fc7a29938_1024x1024.webp?v=1779356242,https://www.cosrx.com/cdn/shop/files/BluePeptide_Serum_07_f40b94b8-8231-4c1a-93ac-962e1ccb5a46_1024x1024.webp?v=1779356251,https://www.cosrx.com/cdn/shop/files/BluePeptide_Serum_08_1024x1024.webp?v=1777521460,https://www.cosrx.com/cdn/shop/files/BluePeptide_Serum_10_1024x1024.webp?v=1779356257,https://www.cosrx.com/cdn/shop/files/BluePeptide_Serum_11__3_1024x1024.webp?v=1777521460,https://www.cosrx.com/cdn/shop/files/BluePeptide_Serum_14_1024x1024.webp?v=1777522179,https://www.cosrx.com/cdn/shop/files/BluePeptide_Serum_15__2_1024x1024.webp?v=1777522179,https://www.cosrx.com/cdn/shop/files/BluePeptide_Serum_17_5a79319f-0b1b-44bc-800e-733f54acbee9_1024x1024.webp?v=1779356260,https://www.cosrx.com/cdn/shop/files/The_blue_peptide_serum_derma_moods_A_1024x1024.jpg?v=1782973484,https://www.cosrx.com/cdn/shop/files/600x750_MO__01_300x.jpg?v=1754049528","AQUA/WATER, BUTYLENE GLYCOL, GLYCERIN, DIPROPYLENE GLYCOL, NIACINAMIDE, 1,2-HEXANEDIOL, BETAINE, DIETHOXYETHYL SUCCINATE, AMMONIUM ACRYLOYLDIMETHYLTAURATE/VP COPOLYMER, DIMETHICONE, COPPER TRIPEPTIDE-1(GHK-Cu), POLYGLYCERYL-6 CAPRYLATE, POLYGLYCERYL-4 CAPRATE, BAKUCHIOL, HYDROGENATED LECITHIN, ALCOHOL, SODIUM METHYL STEAROYL TAURATE, ETHYLHEXYLGLYCERIN, HYDROXYPROPYL STARCH PHOSPHATE, DISODIUM EDTA, ADENOSINE, CAPRYLYL GLYCOL, TOCOPHEROL, DIPEPTIDE DIAMINOBUTYROYL BENZYLAMIDE DIACETATE, ACETYL HEXAPEPTIDE-1, ACETYL HEPTAPEPTIDE-4, PANTHENOL, INOSITOL, ACETYL HEXAPEPTIDE-8, SODIUM HYDROXIDE, PROPANEDIOL, BETA-GLUCAN, SODIUM HYALURONATE, HYALURONIC ACID, SODIUM HYALURONATE CROSSPOLYMER, HYDROLYZED COLLAGEN, HYDROLYZED HYALURONIC ACID, SODIUM ACETYLATED HYALURONATE, ACETYL OCTAPEPTIDE-3",Jar / 100g
COSRX The Blue Peptide Bakuchiol Plump Bounce Cream,$28.00,"https://www.cosrx.com/cdn/shop/files/BluePeptide_Cream_00_800x.webp?v=1779876169,https://www.cosrx.com/cdn/shop/files/BluePeptide_Cream_00.webp?v=1779876169&width=480,https://www.cosrx.com/cdn/shop/files/BluePeptide_Cream_01__1_1024x1024.webp?v=1779876169,https://www.cosrx.com/cdn/shop/files/BluePeptide__-_1_4a29784c-2bb4-4edb-bae8-8ae8587d4320_1024x1024.jpg?v=1780658817,https://www.cosrx.com/cdn/shop/files/BluePeptide_Cream_02_1_1024x1024.webp?v=1779876169,https://www.cosrx.com/cdn/shop/files/BluePeptide_Cream_03_1_1024x1024.webp?v=1779876169,https://www.cosrx.com/cdn/shop/files/BluePeptide_Cream_05_1_1024x1024.webp?v=1779876169,https://www.cosrx.com/cdn/shop/files/BluePeptide_Cream_06__1_1024x1024.webp?v=1779876169,https://www.cosrx.com/cdn/shop/files/BluePeptide_Cream_07__1_1024x1024.webp?v=1779876169,https://www.cosrx.com/cdn/shop/files/BluePeptide_Cream_08_2_1024x1024.webp?v=1779876702,https://www.cosrx.com/cdn/shop/files/BluePeptide_Cream_09_1_1024x1024.webp?v=1779876169,https://www.cosrx.com/cdn/shop/files/BluePeptide_Cream_10_c28a7c66-d165-4548-85f4-39395dd08677_1024x1024.webp?v=1779876216,https://www.cosrx.com/cdn/shop/files/BluePeptide_Cream_12__1_1024x1024.webp?v=1779876511,https://www.cosrx.com/cdn/shop/files/BluePeptide_Cream_13_1024x1024.webp?v=1779876800,https://www.cosrx.com/cdn/shop/files/BluePeptide_Cream_16__1_1024x1024.webp?v=1779876654,https://www.cosrx.com/cdn/shop/files/BluePeptide_Cream_17_1024x1024.webp?v=1779876217,https://www.cosrx.com/cdn/shop/files/BluePeptide_Cream_18_1024x1024.webp?v=1779876616,https://www.cosrx.com/cdn/shop/files/BluePeptide_Cream_19_1024x1024.webp?v=1779876578,https://www.cosrx.com/cdn/shop/files/BluePeptide_Cream_22_1_1024x1024.webp?v=1779876216,https://www.cosrx.com/cdn/shop/files/20260414_cosrx09192_R1_1_1024x1024.jpg?v=1783311400,https://www.cosrx.com/cdn/shop/files/600x750_MO__01_300x.jpg?v=1754049528","AQUA/WATER, BUTYLENE GLYCOL, GLYCERIN, METHYL TRIMETHICONE, NIACINAMIDE, 1,2-HEXANEDIOL, CETEARYL ALCOHOL, SQUALANE, DIMETHICONE, CAPRYLYL METHICONE, COPPER TRIPEPTIDE-1 (GHK-Cu), CAPRYLIC/CAPRIC TRIGLYCERIDE, AMMONIUM ACRYLOYLDIMETHYLTAURATE/VP COPOLYMER, AMMONIUM ACRYLOYLDIMETHYLTAURATE/BEHENETH-25 METHACRYLATE CROSSPOLYMER, POLYACRYLATE CROSSPOLYMER-6, GLYCERYL STEARATE, C30-45 ALKYL CETEARYL DIMETHICONE CROSSPOLYMER, CETEARYL GLUCOSIDE, HYDROGENATED LECITHIN, GLYCERYL CAPRYLATE, ETHYLHEXYLGLYCERIN, STEARIC ACID, POLYGLYCERYL-3 METHYLGLUCOSE DISTEARATE, PALMITIC ACID, SODIUM GLUCONATE, BAKUCHIOL, ADENOSINE, MYRISTIC ACID, LAURIC ACID, CAPRYLYL GLYCOL, TOCOPHEROL, DIPEPTIDE DIAMINOBUTYROYL BENZYLAMIDE DIACETATE, ACETYL HEXAPEPTIDE-1, ACETYL HEPTAPEPTIDE-4, PANTHENOL, BETAINE, INOSITOL, ACETYL HEXAPEPTIDE-8, SODIUM HYDROXIDE, PROPANEDIOL, SYNTHETIC WAX, SODIUM HYALURONATE, ACETYL OCTAPEPTIDE-3, POLYGLYCERYL-10 STEARATE, HYDROLYZED HYALURONIC ACID, BETA-GLUCAN, SODIUM HYALURONATE CROSSPOLYMER, CERAMIDE NP, HYALURONIC ACID, CHOLESTEROL, HYDROLYZED COLLAGEN, SODIUM ACETYLATED HYALURONATE",Jar / 100g
COSRX Azelaic Acid 10 B5 Redness Soothing Cream,$20.00,"https://www.cosrx.com/cdn/shop/files/AzelaicAcid_10_Cream_00_800x.webp?v=1782456881,https://www.cosrx.com/cdn/shop/files/AzelaicAcid_10_Cream_00.webp?v=1782456881&width=480,https://www.cosrx.com/cdn/shop/files/AzelaicAcid_10_Cream_01_1024x1024.webp?v=1782710254,https://www.cosrx.com/cdn/shop/files/AzelaicAcid_10_Cream_02_1024x1024.webp?v=1782710254,https://www.cosrx.com/cdn/shop/files/AzelaicAcid_10_Cream_03_1024x1024.webp?v=1782710255,https://www.cosrx.com/cdn/shop/files/AzelaicAcid_10_Cream_05_1024x1024.webp?v=1782710255,https://www.cosrx.com/cdn/shop/files/AzelaicAcid_10_Cream_06_1024x1024.webp?v=1782710255,https://www.cosrx.com/cdn/shop/files/AzelaicAcid_10_Cream_07_1024x1024.webp?v=1782710254,https://www.cosrx.com/cdn/shop/files/AzelaicAcid_10_Cream_08_1024x1024.webp?v=1782710254,https://www.cosrx.com/cdn/shop/files/AzelaicAcid_10_Cream_09_1024x1024.webp?v=1782710254,https://www.cosrx.com/cdn/shop/files/AzelaicAcid_10_Cream_10_1024x1024.webp?v=1782710254,https://www.cosrx.com/cdn/shop/files/AzelaicAcid_10_Cream_11_1024x1024.webp?v=1782710255,https://www.cosrx.com/cdn/shop/files/AzelaicAcid_10_Cream_12__-elementor-io-optimized_1024x1024.webp?v=1782718423,https://www.cosrx.com/cdn/shop/files/AzelaicAcid_10_Cream_13_1024x1024.webp?v=1782710342,https://www.cosrx.com/cdn/shop/files/AzelaicAcid_10_Cream_14_1024x1024.webp?v=1782710342,https://www.cosrx.com/cdn/shop/files/AzelaicAcid_10_Cream_15_1024x1024.webp?v=1782710342,https://www.cosrx.com/cdn/shop/files/AzelaicAcid_10_Cream_16_1024x1024.webp?v=1782710342,https://www.cosrx.com/cdn/shop/files/AzelaicAcid_10_Cream_18_1024x1024.webp?v=1782710342,https://www.cosrx.com/cdn/shop/files/AzelaicAcid_10_Cream_19_1024x1024.webp?v=1782710342,https://www.cosrx.com/cdn/shop/files/600x750_MO__01_300x.jpg?v=1754049528","AQUA/WATER, AZELAIC ACID, PROPANEDIOL, GLYCERIN, COCO-CAPRYLATE/CAPRATE, C9-12 ALKANE, CETEARYL ALCOHOL, C12-15 ALKYL BENZOATE, SORBITAN STEARATE, CETEARYL OLIVATE, 1,2-HEXANEDIOL, DIMETHICONOL, AMMONIUM ACRYLOYLDIMETHYLTAURATE/VP COPOLYMER, SORBITAN OLIVATE, HYDROXYETHYL ACRYLATE/SODIUM ACRYLOYLDIMETHYL TAURATE COPOLYMER, TROMETHAMINE, SUCROSE COCOATE, SODIUM POLYACRYLOYLDIMETHYL TAURATE, SODIUM METAPHOSPHATE, ETHYLHEXYLGLYCERIN, SORBITAN ISOSTEARATE, PANTHENOL, TOCOPHEROL, MADECASSOSIDE, NIACINAMIDE, ALLANTOIN, DIPOTASSIUM GLYCYRRHIZATE, ZINC PCA, GLUCONOLACTONE, ALPHA-ARBUTIN, ASIATICOSIDE, MADECASSIC ACID, ASIATIC ACID, SODIUM HYALURONATE, HYDROLYZED HYALURONIC ACID, SODIUM HYALURONATE CROSSPOLYMER, GLYCYRRHIZA URALENSIS (LICORICE) ROOT EXTRACT, HYALURONIC ACID, DISODIUM EDTA, SODIUM ACETYLATED HYALURONATE",100 mL / 3.38 fl oz
COSRX 5 PDRN Collagen Intense Vitalizing Serum,$25.00,"https://www.cosrx.com/cdn/shop/files/5PDRN_Serum_00_41bfc9ae-bbf5-40a2-a27c-35b27a2f0780_800x.webp?v=1761526605,https://www.cosrx.com/cdn/shop/files/5PDRN_Serum_00_41bfc9ae-bbf5-40a2-a27c-35b27a2f0780.webp?v=1761526605&width=480,https://www.cosrx.com/cdn/shop/files/5PDRN_Serum_01__2_1_1024x1024.webp?v=1761900283,https://www.cosrx.com/cdn/shop/files/5PDRN_Serum_02__1_1024x1024.webp?v=1761900283,https://www.cosrx.com/cdn/shop/files/5PDRN_Serum_03__1_1024x1024.webp?v=1761900283,https://www.cosrx.com/cdn/shop/files/5PDRN_Serum_04__1_1024x1024.webp?v=1761900283,https://www.cosrx.com/cdn/shop/files/5PDRN_Serum_05__1_1024x1024.webp?v=1761900283,https://www.cosrx.com/cdn/shop/files/5PDRN_Serum_08__2_1_1024x1024.webp?v=1762906527,https://www.cosrx.com/cdn/shop/files/5PDRN_Serum_10__1_1024x1024.webp?v=1762906527,https://www.cosrx.com/cdn/shop/files/5PDRN_Serum_11__1_1024x1024.webp?v=1762906527,https://www.cosrx.com/cdn/shop/files/5PDRN_Serum_13__1_1024x1024.webp?v=1762906527,https://www.cosrx.com/cdn/shop/files/5PDRN_Serum_14__1_1024x1024.webp?v=1762906527,https://www.cosrx.com/cdn/shop/files/5PDRN_Serum_17_1024x1024.jpg?v=1762906527,https://www.cosrx.com/cdn/shop/files/5PDRN_Serum_18__2_1024x1024.jpg?v=1762906527,https://www.cosrx.com/cdn/shop/files/5PDRN_Serum_small_fcd9651e-2b7e-450f-941e-228aae44457e_1024x1024.jpg?v=1780550849,https://www.cosrx.com/cdn/shop/files/600x750_MO__01_300x.jpg?v=1754049528","Aqua/Water, Dipropylene Glycol, Butylene Glycol, Pentylene Glycol, Glycerin, Niacinamide, 1,2-Hexanediol, Betaine, Panthenol, Sodium DNA, Ammonium Acryloyldimethyltaurate/VP Copolymer, Polyacrylate Crosspolymer-6, Xanthan Gum, Ethylhexylglycerin, Adenosine, Hydrolyzed Corn Starch, Disodium EDTA, Hydrolyzed Collagen, Sucrose, t-Butyl Alcohol, Lactobacillus Ferment, Allantoin, Alpha-Arbutin, Centella Asiatica Extract, Propanediol, Tocopherol, Sodium Phytate, Sodium Hyaluronate, Hydrolyzed DNA, Caprylyl Glycol, Hydroxypropyltrimonium Hyaluronate, Acetyl Hexapeptide-8, Hydrolyzed Hyaluronic Acid, Sodium Acetylated Hyaluronate, Hyaluronic Acid, Hydrolyzed Sodium Hyaluronate, Sodium Hyaluronate Crosspolymer, Potassium Hyaluronate",100 mL / 3.38 fl oz
COSRX 5 PDRN Hyaluronic Acid Vital Hydrating Hydrogel Mask,$15.00,"https://www.cosrx.com/cdn/shop/files/5PDRN_Hydrogel_Mask_00_800x.webp?v=1761526641,https://www.cosrx.com/cdn/shop/files/5PDRN_Hydrogel_Mask_00.webp?v=1761526641&width=480,https://www.cosrx.com/cdn/shop/files/5PDRN_Hydrogel_Mask_02_1024x1024.webp?v=1775194995,https://www.cosrx.com/cdn/shop/files/5PDRN_Hydrogel_Mask_03_1024x1024.webp?v=1775194995,https://www.cosrx.com/cdn/shop/files/5PDRN_Hydrogel_Mask_05_1024x1024.webp?v=1775194995,https://www.cosrx.com/cdn/shop/files/5PDRN_Hydrogel_Mask_07_1024x1024.webp?v=1775194995,https://www.cosrx.com/cdn/shop/files/5PDRN_Hydrogel_Mask_08_1024x1024.webp?v=1775194995,https://www.cosrx.com/cdn/shop/files/5PDRN_Hydrogel_Mask_09_1024x1024.webp?v=1775194995,https://www.cosrx.com/cdn/shop/files/5PDRN_Hydrogel_Mask_10_1024x1024.webp?v=1775194995,https://www.cosrx.com/cdn/shop/files/5PDRN_Hydrogel_Mask_11_1024x1024.webp?v=1775194995,https://www.cosrx.com/cdn/shop/files/5PDRN_Hydrogel_Mask_12_1024x1024.webp?v=1775194995,https://www.cosrx.com/cdn/shop/files/5PDRN_Hydrogel_Mask_13_1024x1024.webp?v=1775194995,https://www.cosrx.com/cdn/shop/files/5PDRN_Hydrogel_Mask_14_1024x1024.webp?v=1775194995,https://www.cosrx.com/cdn/shop/files/5PDRN_Hydrogel_Mask_15_1024x1024.webp?v=1775194995,https://www.cosrx.com/cdn/shop/files/5PDRN_Hydrogel_Mask_16-1_1024x1024.webp?v=1775194995,https://www.cosrx.com/cdn/shop/files/5PDRN_Hydrogel_Mask_17_1_1024x1024.webp?v=1775194995,https://www.cosrx.com/cdn/shop/files/5PDRN_Hydrogel_Mask_19_1024x1024.webp?v=1775194995,https://www.cosrx.com/cdn/shop/files/5PDRN_Hydrogel_Mask_20_1024x1024.webp?v=1775194995,https://www.cosrx.com/cdn/shop/files/5PDRN_Hydrogel_Mask_21_1024x1024.webp?v=1775194995,https://www.cosrx.com/cdn/shop/files/5PDRN_Hydrogel_Mask_22_1024x1024.webp?v=1775194995,https://www.cosrx.com/cdn/shop/files/5PDRN_Hydrogel_Mask_23_1024x1024.webp?v=1775194995,https://www.cosrx.com/cdn/shop/files/5PDRN_Hydrogel_Mask_24_1024x1024.webp?v=1775194995,https://www.cosrx.com/cdn/shop/files/1_aa33d15d-932c-41fd-9443-4c873458fea7_1024x1024.jpg?v=1775194995,https://www.cosrx.com/cdn/shop/files/600x750_MO__01_300x.jpg?v=1754049528","Aqua/Water, Glycerin, Acrylates Copolymer, Niacinamide, 1,2-Hexanediol, Ceratonia Siliqua (Carob) Gum, Chondrus Crispus, Agar, Sclerotium Gum, Potassium Chloride, Sucrose, Butylene Glycol, Sodium Hyaluronate, Cellulose Gum, Polyglyceryl-10 Laurate, Panthenol, Allantoin, Xanthan Gum, Ethylhexylglycerin, Adenosine, Coptis Japonica Root Extract, Sodium Phytate, Sodium DNA, Alpha-Arbutin, Cyanocobalamin, Lactobacillus Ferment, Hydrolyzed Collagen, Centella Asiatica Extract, Caprylyl Glycol, Hydroxypropyltrimonium Hyaluronate, Hydrolyzed Hyaluronic Acid, Hydrolyzed Sodium Hyaluronate, Hyaluronic Acid, Potassium Hyaluronate, Sodium Hyaluronate Crosspolymer, Tocopherol, Acetyl Hexapeptide-8, Propanediol, Pentylene Glycol, Sodium Acetylated Hyaluronate, Hydrolyzed DNA",3ea
COSRX 5 PDRN B5 Vital Soothing Toner,$23.00,"https://www.cosrx.com/cdn/shop/files/5PDRN_Toner_00_800x.webp?v=1761526535,https://www.cosrx.com/cdn/shop/files/5PDRN_Toner_00.webp?v=1761526535&width=480,https://www.cosrx.com/cdn/shop/files/5PDRN_Toner_01__2_1024x1024.webp?v=1761732095,https://www.cosrx.com/cdn/shop/files/5PDRN_Toner_02_1024x1024.webp?v=1761732095,https://www.cosrx.com/cdn/shop/files/5PDRN_Toner_03_1024x1024.webp?v=1761732095,https://www.cosrx.com/cdn/shop/files/5PDRN_Toner_04_1024x1024.webp?v=1761732095,https://www.cosrx.com/cdn/shop/files/5PDRN_Toner_05_1024x1024.webp?v=1761732095,https://www.cosrx.com/cdn/shop/files/5PDRN_Toner_07__2_1024x1024.webp?v=1762906197,https://www.cosrx.com/cdn/shop/files/5PDRN_Toner_09__2_1024x1024.webp?v=1762906197,https://www.cosrx.com/cdn/shop/files/5PDRN_Toner_10_1024x1024.webp?v=1762906197,https://www.cosrx.com/cdn/shop/files/5PDRN_Toner_12_1024x1024.webp?v=1762906197,https://www.cosrx.com/cdn/shop/files/5PDRN_Toner_14_1024x1024.webp?v=1762906197,https://www.cosrx.com/cdn/shop/files/5PDRN_Serum_17_1024x1024.webp?v=1762906197,https://www.cosrx.com/cdn/shop/files/5PDRN_Serum_18__2_1024x1024.webp?v=1762906197,https://www.cosrx.com/cdn/shop/files/5PDRN_Toner_small_090947f5-045b-4df5-8c53-548d7db64f19_1024x1024.jpg?v=1780550880,https://www.cosrx.com/cdn/shop/files/600x750_MO__01_300x.jpg?v=1754049528","Aqua/Water, Butylene Glycol, Glycerin, Niacinamide, Pentylene Glycol, 2,3-Butanediol, 1,2-Hexanediol, Betaine, Diethoxyethyl Succinate, Sodium DNA, Carbomer, Arginine, Panthenol, Ethylhexylglycerin, Adenosine, Hydrolyzed Corn Starch, Disodium EDTA, Allantoin, Sucrose, Lactobacillus Ferment, Pantothenic Acid, Alpha-Arbutin, Hydrolyzed Collagen, Centella Asiatica Extract, Propanediol, Tocopherol, Sodium Phytate, Sodium Hyaluronate, Hydrolyzed DNA, Caprylyl Glycol, Hydroxypropyltrimonium Hyaluronate, Acetyl Hexapeptide-8, Hydrolyzed Hyaluronic Acid, Sodium Acetylated Hyaluronate, Hyaluronic Acid, Hydrolyzed Sodium Hyaluronate, Sodium Hyaluronate Crosspolymer, Potassium Hyaluronate",280 mL / 9.46 fl oz
Advanced Snail 96 Mucin Power Essence,$20.00,"https://www.cosrx.com/cdn/shop/files/james_800x1067_1_1_4e9750cc-2cd6-4817-ace5-be2305a85806_800x.jpg?v=1763111577,https://www.cosrx.com/cdn/shop/files/james_800x1067_1_1_4e9750cc-2cd6-4817-ace5-be2305a85806.jpg?v=1763111577&width=480,https://www.cosrx.com/cdn/shop/files/advanced-snail-96-mucin-power-essence-cosrx-official-4_1024x1024.jpg?v=1763111577,https://www.cosrx.com/cdn/shop/files/Snail96Essence_8_1024x1024.jpg?v=1763111577,https://www.cosrx.com/cdn/shop/files/advanced-snail-96-mucin-power-essence-cosrx-official-3_1024x1024.jpg?v=1763111577,https://www.cosrx.com/cdn/shop/files/advanced-snail-96-mucin-power-essence-cosrx-official-5_1024x1024.png?v=1763111577,https://www.cosrx.com/cdn/shop/files/advanced-snail-96-mucin-power-essence-cosrx-official-6_1024x1024.jpg?v=1763111577,https://www.cosrx.com/cdn/shop/files/advanced-snail-96-mucin-power-essence-cosrx-official-7_1024x1024.jpg?v=1763111577,https://www.cosrx.com/cdn/shop/files/advanced-snail-96-mucin-power-essence-cosrx-official-8_1024x1024.jpg?v=1763111577,https://www.cosrx.com/cdn/shop/files/advanced-snail-96-mucin-power-essence-cosrx-official-9_1024x1024.jpg?v=1763111577,https://www.cosrx.com/cdn/shop/files/advanced-snail-96-mucin-power-essence-cosrx-official-10_1024x1024.jpg?v=1763111577,https://www.cosrx.com/cdn/shop/files/800x1067____231120_e9c80f69-91e9-4f80-99f4-e62372240f7b_1024x1024.webp?v=1763111577,https://www.cosrx.com/cdn/shop/files/Snail_96_Promo-Image-1_1024x1024.png?v=1763519441,https://www.cosrx.com/cdn/shop/files/snail-texture-model_1024x1024.png?v=1774510565,https://www.cosrx.com/cdn/shop/files/600x750_MO__01_300x.jpg?v=1754049528","96.3 percent snail secretion filtrate, 1,000 ppm sodium hyaluronate",100mL / 30mL
Advanced Snail 92 All in One Cream,$26.00,"https://www.cosrx.com/cdn/shop/files/snail_cream_thumbnail_800x.png?v=1748420673,https://www.cosrx.com/cdn/shop/files/snail_cream_thumbnail.png?v=1748420673&width=480,https://www.cosrx.com/cdn/shop/files/advanced-snail-92-all-in-one-cream-cosrx-official-4_1024x1024.jpg?v=1762909943,https://www.cosrx.com/cdn/shop/files/advanced-snail-92-all-in-one-cream-cosrx-official-2_1024x1024.jpg?v=1762909943,https://www.cosrx.com/cdn/shop/files/advanced-snail-92-all-in-one-cream-cosrx-official-3_1024x1024.jpg?v=1762909943,https://www.cosrx.com/cdn/shop/files/advanced-snail-92-all-in-one-cream-cosrx-official-5_1024x1024.jpg?v=1762909943,https://www.cosrx.com/cdn/shop/files/advanced-snail-92-all-in-one-cream-cosrx-official-6_1024x1024.jpg?v=1762909943,https://www.cosrx.com/cdn/shop/files/advanced-snail-92-all-in-one-cream-cosrx-official-8_1024x1024.jpg?v=1762909943,https://www.cosrx.com/cdn/shop/files/advanced-snail-92-all-in-one-cream-cosrx-official-9_1024x1024.jpg?v=1762909943,https://www.cosrx.com/cdn/shop/files/advanced-snail-92-all-in-one-cream-cosrx-official-10_1024x1024.png?v=1762909943,https://www.cosrx.com/cdn/shop/files/advanced-snail-92-all-in-one-cream-cosrx-official-11_1024x1024.jpg?v=1762909943,https://www.cosrx.com/cdn/shop/files/advanced-snail-92-all-in-one-cream-cosrx-official-12_1024x1024.jpg?v=1762909943,https://www.cosrx.com/cdn/shop/files/advanced-snail-92-all-in-one-cream-cosrx-official-13_1024x1024.jpg?v=1762909943,https://www.cosrx.com/cdn/shop/files/800x1067____231120_1024x1024.webp?v=1762909943,https://www.cosrx.com/cdn/shop/files/advanced-snail-92-all-in-one-cream-cosrx-official-14_1024x1024.jpg?v=1762909943,https://www.cosrx.com/cdn/shop/files/5_bc6986a1-1b85-42ce-b761-6bc4acbb07a3_1024x1024.png?v=1757571879,https://www.cosrx.com/cdn/shop/files/advanced-snail-92-all-in-one-cream-cosrx-official-15_1024x1024.jpg?v=1757571879,https://www.cosrx.com/cdn/shop/files/advanced-snail-92-all-in-one-cream-cosrx-official-16_1024x1024.jpg?v=1762909943,https://www.cosrx.com/cdn/shop/files/SnailCream200g_800x1067_47f7bb84-ae86-468e-85ca-b86beb3a2f7c_1024x1024.jpg?v=1757571879,https://www.cosrx.com/cdn/shop/files/snail_92_promo_22_1024x1024.png?v=1763605867,https://www.cosrx.com/cdn/shop/files/snail-texture-model_1024x1024.png?v=1774510565,https://www.cosrx.com/cdn/shop/files/600x750_MO__01_300x.jpg?v=1754049528","92% snail secretion filtrate, 1,000 ppm hyaluronic acid",100mL / 50mL / 100g / 200g
Advanced Snail Mucin Gel Cleanser,$18.00,"https://www.cosrx.com/cdn/shop/files/advanced-snail-mucin-gel-cleanser-cosrx-official-1_800x.png?v=1724835788,https://www.cosrx.com/cdn/shop/files/advanced-snail-mucin-gel-cleanser-cosrx-official-1.png?v=1724835788&width=480,https://www.cosrx.com/cdn/shop/files/01_25d36ef8-9a2e-4e01-bcbd-b2e6892d5c78_1024x1024.webp?v=1778476700,https://www.cosrx.com/cdn/shop/files/02_c61cc26b-48c6-4a29-b4e3-d90e9f8dbdaf_1024x1024.webp?v=1778476700,https://www.cosrx.com/cdn/shop/files/05_4c01dd41-694a-41e8-a188-ef58df4a4951_1024x1024.webp?v=1778476701,https://www.cosrx.com/cdn/shop/files/06_01ffbae8-bc65-4996-ab1a-a560035c7eb8_1024x1024.webp?v=1778476701,https://www.cosrx.com/cdn/shop/files/07_2dc35b15-59c3-4e4f-956a-eaade767712a_1024x1024.webp?v=1778476700,https://www.cosrx.com/cdn/shop/files/04_57ed2cec-7e25-4887-a84c-d814e946cf79_1024x1024.webp?v=1778476701,https://www.cosrx.com/cdn/shop/files/08_5f155054-c22c-409f-872b-9aedfebfdc55_1024x1024.webp?v=1778476701,https://www.cosrx.com/cdn/shop/files/600x750_MO__01_300x.jpg?v=1754049528","Water, Acrylates Copolymer, Butylene Glycol, Glycerin, Disodium Laureth Sulfosuccinate, Sodium Cocoyl Isethionate, 1,2-Hexanediol, Coco-Glucoside, Lauryl Betaine, Snail Secretion Filtrate, Arginine, Tromethamine, Potassium Cocoyl Glycinate, Fragrance, Carbomer, Sodium Chloride, Ethylhexylglycerin, Acrylates/C10-30 Alkyl Acrylate Crosspolymer, Sodium Polyacrylate, Disodium EDTA",5.07 fl.oz / 150ml
The Ceramide Skin Barrier Moisturizer,$23.00,"https://www.cosrx.com/cdn/shop/files/Skinbarrier_Moisturizer_800x1067_shape_800x.jpg?v=1752553177,https://www.cosrx.com/cdn/shop/files/Skinbarrier_Moisturizer_800x1067_shape.jpg?v=1752553177&width=480,https://www.cosrx.com/cdn/shop/files/Skinbarrier_Moisturizer_02__2_1024x1024.jpg?v=1752553177,https://www.cosrx.com/cdn/shop/files/Skinbarrier_Moisturizer_03__2_1024x1024.jpg?v=1752553177,https://www.cosrx.com/cdn/shop/files/Skinbarrier_Moisturizer_04_1024x1024.jpg?v=1752553177,https://www.cosrx.com/cdn/shop/files/Skinbarrier_Moisturizer_01__5_1024x1024.webp?v=1756458228,https://www.cosrx.com/cdn/shop/files/Skinbarrier_Moisturizer_06_1024x1024.jpg?v=1756458228,https://www.cosrx.com/cdn/shop/files/Skinbarrier_Moisturizer_07__2_1024x1024.jpg?v=1756458228,https://www.cosrx.com/cdn/shop/files/Skinbarrier_Moisturizer_08B-1_1024x1024.jpg?v=1756458228,https://www.cosrx.com/cdn/shop/files/Skinbarrier_Moisturizer_08B-2_1024x1024.jpg?v=1756458228,https://www.cosrx.com/cdn/shop/files/Skinbarrier_Moisturizer_10__2_1024x1024.jpg?v=1756458228,https://www.cosrx.com/cdn/shop/files/Skinbarrier_Moisturizer_11__2_1024x1024.jpg?v=1756458228,https://www.cosrx.com/cdn/shop/files/Skinbarrier_Moisturizer_12A__3-1_1024x1024.jpg?v=1756458228,https://www.cosrx.com/cdn/shop/files/Skinbarrier_Moisturizer_13__3_1024x1024.jpg?v=1756458228,https://www.cosrx.com/cdn/shop/files/Skinbarrier_Moisturizer_15_1024x1024.jpg?v=1756458228,https://www.cosrx.com/cdn/shop/files/Skinbarrier_Moisturizer_16_1024x1024.jpg?v=1756458228,https://www.cosrx.com/cdn/shop/files/Skinbarrier_Moisturizer_17_1024x1024.jpg?v=1756458228,https://www.cosrx.com/cdn/shop/files/Skinbarrier_Moisturizer_18_c0a51ecc-5fe0-42df-b778-5610ad37c2bd_1024x1024.jpg?v=1756458228,https://www.cosrx.com/cdn/shop/files/Skinbarrier_Moisturizer_19_1024x1024.jpg?v=1756458228,https://www.cosrx.com/cdn/shop/files/ceramide_barrier_moisturizer_promo_1_1024x1024.png?v=1763608898,https://www.cosrx.com/cdn/shop/files/600x750_MO__01_300x.jpg?v=1754049528","1.5% Ceramides, Cholesterol + Fatty Acids",80mL
