name,price,images,Key Ingredients,Size
Master Patch Basic [90ea],$25.00,"https://www.cosrx.com/cdn/shop/files/master-patch-basic-90ea-cosrx-official-1_800x.jpg?v=1724836465,https://www.cosrx.com/cdn/shop/files/master-patch-basic-90ea-cosrx-official-1.jpg?v=1724836465&width=480,https://www.cosrx.com/cdn/shop/files/master-patch-basic-90ea-cosrx-official-2_1024x1024.jpg?v=1724836467,https://www.cosrx.com/cdn/shop/files/master-patch-basic-90ea-cosrx-official-3_1024x1024.jpg?v=1724836469,https://www.cosrx.com/cdn/shop/files/master-patch-basic-90ea-cosrx-official-4_1024x1024.jpg?v=1724836471,https://www.cosrx.com/cdn/shop/files/master-patch-basic-90ea-cosrx-official-5_1024x1024.jpg?v=1724836473,https://www.cosrx.com/cdn/shop/files/master-patch-basic-90ea-cosrx-official-6_1024x1024.png?v=1724836476,https://www.cosrx.com/cdn/shop/files/master-patch-basic-90ea-cosrx-official-7_1024x1024.png?v=1724836479,https://www.cosrx.com/cdn/shop/files/600x750_MO__01_300x.jpg?v=1754049528",,1 Pack
Airy-Light Invisible Sun Stick,$0.00,"https://www.cosrx.com/cdn/shop/files/Airy-Light_SunStick_00_800x.webp?v=1749081344,https://www.cosrx.com/cdn/shop/files/Airy-Light_SunStick_01__3_1024x1024.webp?v=1749081344,https://www.cosrx.com/cdn/shop/files/Airy-Light_SunStick_02__2_1024x1024.webp?v=1749081344,https://www.cosrx.com/cdn/shop/files/Airy-Light_SunStick_03_1024x1024.webp?v=1749081344,https://www.cosrx.com/cdn/shop/files/Airy-Light_SunStick_04__2_1024x1024.webp?v=1749081344,https://www.cosrx.com/cdn/shop/files/Airy-Light_SunStick_05__2_1024x1024.webp?v=1749081344,https://www.cosrx.com/cdn/shop/files/Airy-Light_SunStick_06__2_1024x1024.webp?v=1749081344,https://www.cosrx.com/cdn/shop/files/Airy-Light_SunStick_08_1024x1024.webp?v=1749081344,https://www.cosrx.com/cdn/shop/files/Airy-Light_SunStick_09_1024x1024.webp?v=1749081344,https://www.cosrx.com/cdn/shop/files/Airy-Light_SunStick_10_1024x1024.webp?v=1749081344,https://www.cosrx.com/cdn/shop/files/Airy-Light_SunStick_11__2_1024x1024.webp?v=1749081344,https://www.cosrx.com/cdn/shop/files/Airy-Light_SunStick_12_1024x1024.webp?v=1749081344,https://www.cosrx.com/cdn/shop/files/Airy-Light_SunStick_13_1024x1024.webp?v=1749081344,https://www.cosrx.com/cdn/shop/files/Airy-Light_SunStick_14_1024x1024.webp?v=1749081344,https://www.cosrx.com/cdn/shop/files/Airy-Light_SunStick_15_1024x1024.webp?v=1749081344,https://www.cosrx.com/cdn/shop/files/Airy-Light_SunStick_16__2_1024x1024.webp?v=1749081344,https://www.cosrx.com/cdn/shop/files/Airy-Light_SunStick_17_1024x1024.webp?v=1749081344,https://www.cosrx.com/cdn/shop/files/Airy-Light_SunStick_18_1024x1024.webp?v=1749081344,https://www.cosrx.com/cdn/shop/files/600x750_MO__01_300x.jpg?v=1754049528","Methyl Methacrylate Crosspolymer, Synthetic Wax, Caprylyl Methicone, Vinyl Dimethicone/Methicone Silsesquioxane Crosspolymer, Coco-Caprylate/Caprate, Dicaprylyl Carbonate, Ethylhexyl Palmitate, Butyloctyl Salicylate, Neopentyl Glycol Diheptanoate, Diethylamino Hydroxybenzoyl Hexyl Benzoate, Ethylhexyl Triazone, Ozokerite, Tocopheryl Acetate, Silica, Vinyl Dimethicone, Polysilicone-15, Synthetic Fluorphlogopite, Propylheptyl Caprylate, Bis-Ethylhexyloxyphenol Methoxyphenyl Triazine, Ceresin, Bisabolol, Polyglyceryl-4 Diisostearate/Polyhydroxystearate/Sebacate, Triethoxycaprylylsilane, Glyceryl Caprylate, Caprylyl Glycol, Disteardimonium Hectorite, Ethylhexylglycerin, Triethyl Citrate, Tocopherol, Ceramide NP, Water, Niacinamide, Allantoin, Zinc PCA, Panthenol, 1,2-Hexanediol, Sodium Hyaluronate, Aloe Barbadensis Leaf Water",Jar / 100g
COSRX One Step Green Calming Pad,$22.00,"https://www.cosrx.com/cdn/shop/files/Green_Pad_0_800x.jpg?v=1694078299,https://www.cosrx.com/cdn/shop/files/Green_Pad_0.jpg?v=1694078299&width=480,https://www.cosrx.com/cdn/shop/files/Green_Pad_1_2_1024x1024.jpg?v=1726731326,https://www.cosrx.com/cdn/shop/files/Green_Pad_2_1024x1024.jpg?v=1725350806,https://www.cosrx.com/cdn/shop/products/Green_Pad_12_1024x1024.jpg?v=1725350806,https://www.cosrx.com/cdn/shop/files/Green_Pad_3_1024x1024.jpg?v=1725350806,https://www.cosrx.com/cdn/shop/files/Green_Pad_4_1024x1024.jpg?v=1725350806,https://www.cosrx.com/cdn/shop/files/Green_Pad_5_1024x1024.jpg?v=1725350806,https://www.cosrx.com/cdn/shop/files/Green_Pad_6_1024x1024.jpg?v=1725350806,https://www.cosrx.com/cdn/shop/files/Green_Pad_8_1024x1024.jpg?v=1725350806,https://www.cosrx.com/cdn/shop/files/Green_Pad_7_1024x1024.jpg?v=1725350806,https://www.cosrx.com/cdn/shop/files/Green_Pad_9_1024x1024.jpg?v=1725350806,https://www.cosrx.com/cdn/shop/files/Green_Pad_10_1024x1024.jpg?v=1725350806,https://www.cosrx.com/cdn/shop/files/600x750_MO__01_300x.jpg?v=1754049528",,Jar / 100g
Perfect Sebum Centella Powder Puff OPP,$3.00,"https://www.cosrx.com/cdn/shop/files/perfect-sebum-centella-powder-puff-opp-cosrx-official_800x.jpg?v=1724836036,https://www.cosrx.com/cdn/shop/files/perfect-sebum-centella-powder-puff-opp-cosrx-official.jpg?v=1724836036&width=480,https://www.cosrx.com/cdn/shop/files/600x750_MO__01_300x.jpg?v=1754049528",,Jar / 100g
Aloe Soothing Sun Cream  SPF50+/ PA+++,$16.00,"https://www.cosrx.com/cdn/shop/files/aloe-soothing-sun-cream-spf50-pa-cosrx-official-1_800x.jpg?v=1724835559,https://www.cosrx.com/cdn/shop/files/aloe-soothing-sun-cream-spf50-pa-cosrx-official-1.jpg?v=1724835559&width=480,https://www.cosrx.com/cdn/shop/files/aloe-soothing-sun-cream-spf50-pa-cosrx-official-2_1024x1024.jpg?v=1724835561,https://www.cosrx.com/cdn/shop/files/aloe-soothing-sun-cream-spf50-pa-cosrx-official-3_1024x1024.jpg?v=1724835563,https://www.cosrx.com/cdn/shop/files/aloe-soothing-sun-cream-spf50-pa-cosrx-official-4_1024x1024.jpg?v=1724835566,https://www.cosrx.com/cdn/shop/files/aloe-soothing-sun-cream-spf50-pa-cosrx-official-5_1024x1024.jpg?v=1724835568,https://www.cosrx.com/cdn/shop/files/aloe-soothing-sun-cream-spf50-pa-cosrx-official-6_1024x1024.jpg?v=1724835570,https://www.cosrx.com/cdn/shop/files/aloe-soothing-sun-cream-spf50-pa-cosrx-official-7_1024x1024.jpg?v=1724835572,https://www.cosrx.com/cdn/shop/files/aloe-soothing-sun-cream-spf50-pa-cosrx-official-8_1024x1024.jpg?v=1724835574,https://www.cosrx.com/cdn/shop/files/aloe-soothing-sun-cream-spf50-pa-cosrx-official-9_1024x1024.jpg?v=1724835576,https://www.cosrx.com/cdn/shop/files/aloe-soothing-sun-cream-spf50-pa-cosrx-official-10_1024x1024.jpg?v=1724835579,https://www.cosrx.com/cdn/shop/files/600x750_MO__01_300x.jpg?v=1754049528","WATER, ETHYLHEXYL METHOXYCINNAMATE, GLYCERIN, PROPYLENE GLYCOL, CYCLOPENTASILOXANE, PHENYLBENZIMIDAZOLE SULFONIC ACID, BIS-ETHYLHEXYLOXYPHENOL METHOXYPHENYL TRIAZINE, DICAPRYLYL CARBONATE, ISOAMYL P-METHOXYCINNAMATE, POTASSIUM CETYL PHOSPHATE, ALCOHOL, DIMETHICONE, BUTYLENE GLYCOL, GLYCERYL STEARATE, TITANIUM DIOXIDE, C14-22 ALCOHOLS, POLYMETHYL METHACRYLATE, CETEARYL ALCOHOL, PEG-100 STEARATE, TRIETHANOLAMINE, SILICA, SODIUM HYDROXIDE, DIMETHICONE/VINYL DIMETHICONE CROSSPOLYMER, C12-20 ALKYL GLUCOSIDE, ALUMINUM HYDROXIDE, STEARIC ACID, FRAGRANCE, CAPRYLYL GLYCOL, PHENOXYETHANOL, ACRYLATES/C10-30 ALKYL ACRYLATE CROSSPOLYMER, ALOE ARBORESCENS LEAF EXTRACT, DIPOTASSIUM GLYCYRRHIZATE, CARBOMER, XANTHAN GUM, LIMONENE, TOCOPHERYL ACETATE, DISODIUM EDTA, HEXYL CINNAMAL, LINALOOL, BENZYL SALICYLATE, GERANIOL, BENZYL ALCOHOL, CITRONELLOL, BENZYL BENZOATE, CITRAL",50ml / 1.69 fl.oz
Aloe 54.2 Aqua Tone-up Sunscreen SPF 50+ PA++++,$0.00,"https://www.cosrx.com/cdn/shop/files/aloe-54-2-aqua-tone-up-sunscreen-spf-50-pa-cosrx-official-1_800x.jpg?v=1724836911,https://www.cosrx.com/cdn/shop/files/aloe-54-2-aqua-tone-up-sunscreen-spf-50-pa-cosrx-official-1.jpg?v=1724836911&width=480,https://www.cosrx.com/cdn/shop/files/aloe-54-2-aqua-tone-up-sunscreen-spf-50-pa-cosrx-official-2_1024x1024.jpg?v=1724836913,https://www.cosrx.com/cdn/shop/files/aloe-54-2-aqua-tone-up-sunscreen-spf-50-pa-cosrx-official-3_1024x1024.jpg?v=1724836915,https://www.cosrx.com/cdn/shop/files/aloe-54-2-aqua-tone-up-sunscreen-spf-50-pa-cosrx-official-4_1024x1024.jpg?v=1724836917,https://www.cosrx.com/cdn/shop/files/aloe-54-2-aqua-tone-up-sunscreen-spf-50-pa-cosrx-official-5_1024x1024.jpg?v=1724836919,https://www.cosrx.com/cdn/shop/files/aloe-54-2-aqua-tone-up-sunscreen-spf-50-pa-cosrx-official-6_1024x1024.jpg?v=1724836921,https://www.cosrx.com/cdn/shop/files/aloe-54-2-aqua-tone-up-sunscreen-spf-50-pa-cosrx-official-7_1024x1024.jpg?v=1724836923,https://www.cosrx.com/cdn/shop/files/aloe-54-2-aqua-tone-up-sunscreen-spf-50-pa-cosrx-official-8_1024x1024.jpg?v=1724836925,https://www.cosrx.com/cdn/shop/files/600x750_MO__01_300x.jpg?v=1754049528","Aloe Barbadensis Leaf Water, Homosalate, Butylene Glycol, Diethylamino Hydroxybenzoyl Hexyl Benzoate, EthylhexylSalicylate, Glycerin, Water, Bis-Ethylhexyloxyphenol Methoxyphenyl Triazine, C12-15 Alkyl Benzoate, Methyl Trimethicone, Niacinamide, Titanium Dioxide (CI 77891), Diisopropyl Sebacate, Terephthalylidene Dicamphor Sulfonic Acid, 1,2-Hexanediol, Potassium CetylPhosphate, Cetearyl Alcohol, Tromethamine, Glyceryl Stearate, Behenyl Alcohol, Polyacrylate Crosspolymer-6, Xanthan Gum, Sodium Polyacryloyldimethyl Taurate, Hydrogenated Lecithin, Poly C10-30 Alkyl Acrylate, Ethylhexylglycerin, Stearic Acid, Aluminum Hydroxide,Polyglyceryl-3 Methylglucose Distearate, Palmitic Acid, Iron Oxides (CI 77491), Disodium EDTA, Triethoxycaprylylsilane, Iron Oxides (CI 77492), Sodium Hyaluronate, Allantoin, Myristic Acid, Cyanocobalamin, Lauric Acid, Tocopherol",50ml / 1.69 fl.oz
Ultra-Light Invisible Sunscreen SPF50 PA++++,$16.00,"https://www.cosrx.com/cdn/shop/files/0_Ultra_light_invisible_800x1067_3b3f194c-15a5-4c66-92ec-58275778c6c9_800x.jpg?v=1714098876,https://www.cosrx.com/cdn/shop/files/0_Ultra_light_invisible_800x1067_3b3f194c-15a5-4c66-92ec-58275778c6c9.jpg?v=1714098876&width=480,https://www.cosrx.com/cdn/shop/files/Ultra_light_invisible_Sun_1_67b72102-93e5-431f-8ca7-450eec05fe5a_1024x1024.jpg?v=1716971740,https://www.cosrx.com/cdn/shop/files/Ultra_light_invisible_Sun_3_1024x1024.jpg?v=1716862508,https://www.cosrx.com/cdn/shop/files/Ultra_light_invisible_Sun_4_1024x1024.jpg?v=1716862508,https://www.cosrx.com/cdn/shop/files/Ultra_light_invisible_Sun_7_1024x1024.jpg?v=1724837138,https://www.cosrx.com/cdn/shop/files/Ultra_light_invisible_Sun_9_1024x1024.jpg?v=1716862508,https://www.cosrx.com/cdn/shop/files/Ultra_light_invisible_Sun_17_1024x1024.jpg?v=1724837142,https://www.cosrx.com/cdn/shop/files/Ultra_light_invisible_Sun_17_902e676e-e3ce-4fae-aaf8-1696d2e66226_1024x1024.jpg?v=1724837144,https://www.cosrx.com/cdn/shop/files/Ultra_light_invisible_Sun_13_1024x1024.jpg?v=1724837146,https://www.cosrx.com/cdn/shop/files/Ultra_light_invisible_Sun_10_1024x1024.jpg?v=1716862508,https://www.cosrx.com/cdn/shop/files/Ultra_light_invisible_Sun_12_1024x1024.jpg?v=1716862508,https://www.cosrx.com/cdn/shop/files/Ultra_light_invisible_Sun_14_1024x1024.jpg?v=1724837153,https://www.cosrx.com/cdn/shop/files/Ultra_light_invisible_Sun_15_1024x1024.jpg?v=1716862508,https://www.cosrx.com/cdn/shop/files/Ultra_light_invisible_Sun_16_1024x1024.jpg?v=1724837157,https://www.cosrx.com/cdn/shop/files/600x750_MO__01_300x.jpg?v=1754049528","Aloe Barbadensis Leaf Water, Diethylhexyl Succinate, Propanediol, Aqua/Water, Drometrizole Trisiloxane, Ethylhexyl Triazone, Niacinamide, Diethylamino Hydroxybenzoyl Hexyl Benzoate, Terephthalylidene Dicamphor Sulfonic Acid, 1,2-Hexanediol, Behenyl Alcohol, Methyl Trimethicone, Sodium Polyacryloyldimethyl Taurate, Hamamelis Virginiana (Witch Hazel) Leaf Water, Tromethamine, Polyacrylate Crosspolymer-6, Arachidyl Alcohol, Caprylyl Glycol, Ethylhexylglycerin, Arachidyl Glucoside, Sodium Metaphosphate, Adenosine, Tocopherol, Sodium Hyaluronate, Allantoin, Citric Acid, Sodium Benzoate, Potassium Sorbate",50ml / 1.69 fl.oz
The AHA BHA PHA LHA 35 Peel,$19.00,"https://www.cosrx.com/cdn/shop/files/The_35peel_0_800x.webp?v=1724836979,https://www.cosrx.com/cdn/shop/files/The_35peel_0.webp?v=1724836979&width=480,https://www.cosrx.com/cdn/shop/files/The_35peel_1B_1024x1024.webp?v=1697445072,https://www.cosrx.com/cdn/shop/files/The_35peel_2_1024x1024.webp?v=1697445075,https://www.cosrx.com/cdn/shop/files/The_35peel_3_1024x1024.webp?v=1724836985,https://www.cosrx.com/cdn/shop/files/The_35peel_18_1024x1024.webp?v=1724836987,https://www.cosrx.com/cdn/shop/files/The_35peel_5_1024x1024.webp?v=1724836988,https://www.cosrx.com/cdn/shop/files/The_35peel_6_1024x1024.webp?v=1724836990,https://www.cosrx.com/cdn/shop/files/The_35peel_7_1024x1024.webp?v=1697445085,https://www.cosrx.com/cdn/shop/files/The_35peel_8_1024x1024.webp?v=1724836994,https://www.cosrx.com/cdn/shop/files/The_35peel_9_1024x1024.webp?v=1697445089,https://www.cosrx.com/cdn/shop/files/The_35peel_11_2_1024x1024.webp?v=1697445091,https://www.cosrx.com/cdn/shop/files/The_35peel_12_1024x1024.webp?v=1697445093,https://www.cosrx.com/cdn/shop/files/The_35peel_13_1024x1024.webp?v=1697445095,https://www.cosrx.com/cdn/shop/files/The_35peel_14_1024x1024.webp?v=1724837003,https://www.cosrx.com/cdn/shop/files/The_35peel_17_1024x1024.webp?v=1724837005,https://www.cosrx.com/cdn/shop/files/The_35peel_15_1024x1024.webp?v=1724837006,https://www.cosrx.com/cdn/shop/files/600x750_MO__01_300x.jpg?v=1754049528","Water, Glycolic Acid, Lactic Acid, Potassium Hydroxide, Gluconolactone, Mandelic Acid, Dipropylene Glycol, Panthenol, Salicylic Acid(2%), Methylpropanediol, 1,2-Hexanediol, Octyldodeceth-16, Citric Acid, Hydroxyethylcellulose, Pentylene Glycol, Sodium Polyacryloyldimethyl Taurate, Cyanocobalamin, Polyacrylate Crosspolymer-6, Hydroxypropyl Starch Phosphate, Ethylhexylglycerin, Capryloyl Salicylic Acid, Polysorbate 60, Disodium Phosphate, Sodium Phosphate, Tocopherol, Allantoin, Hydrolyzed Hyaluronic Acid",Jar / 100g
AC Collection Blemish Care Sheet Mask,$6.00,"https://www.cosrx.com/cdn/shop/files/ac-collection-blemish-care-sheet-mask-cosrx-official-1_800x.jpg?v=1724836188,https://www.cosrx.com/cdn/shop/files/ac-collection-blemish-care-sheet-mask-cosrx-official-1.jpg?v=1724836188&width=480,https://www.cosrx.com/cdn/shop/files/ac-collection-blemish-care-sheet-mask-cosrx-official-2_1024x1024.jpg?v=1724836190,https://www.cosrx.com/cdn/shop/files/ac-collection-blemish-care-sheet-mask-cosrx-official-3_1024x1024.jpg?v=1724836193,https://www.cosrx.com/cdn/shop/files/ac-collection-blemish-care-sheet-mask-cosrx-official-4_1024x1024.jpg?v=1724836195,https://www.cosrx.com/cdn/shop/files/ac-collection-blemish-care-sheet-mask-cosrx-official-5_1024x1024.jpg?v=1724836197,https://www.cosrx.com/cdn/shop/files/ac-collection-blemish-care-sheet-mask-cosrx-official-6_1024x1024.jpg?v=1724836199,https://www.cosrx.com/cdn/shop/files/ac-collection-blemish-care-sheet-mask-cosrx-official-7_1024x1024.jpg?v=1724836201,https://www.cosrx.com/cdn/shop/files/ac-collection-blemish-care-sheet-mask-cosrx-official-8_1024x1024.jpg?v=1724836203,https://www.cosrx.com/cdn/shop/files/ac-collection-blemish-care-sheet-mask-cosrx-official-9_1024x1024.jpg?v=1724836205,https://www.cosrx.com/cdn/shop/files/ac-collection-blemish-care-sheet-mask-cosrx-official-10_1024x1024.jpg?v=1724836208,https://www.cosrx.com/cdn/shop/files/600x750_MO__01_300x.jpg?v=1754049528","Water, Butylene Glycol, Glycerin, Propanediol, Niacinamide, Melaleuca Alternifolia (Tea Tree) Leaf Extract, 1,2-Hexanediol, Hexylene Glycol, Hydroxyacetophenone, Hydroxyethylcellulose, Arginine, Allantoin, Acrylates/C10-30 Alkyl Acrylate Crosspolymer, Dipotassium Glycyrrhizate, Xanthan Gum, Disodium EDTA, Polyglyceryl-10 Myristate, Polyglyceryl-10 Laurate, Melaleuca Alternifolia (Tea Tree) Leaf Oil, Caprylic/Capric Triglyceride, Ectoin, Arbutin, Asiaticoside, Dextrin, Asiatic Acid, Madecassic Acid",Jar / 100g
COSRX PEPTIDE-132 Hair Bonding Mini Kit,$19.44,"https://www.cosrx.com/cdn/shop/files/MG_8341_113d90bc-e4ab-4f60-a0ea-9ceb7db683cf_3384x.png?v=1773640481,https://www.cosrx.com/cdn/shop/files/MG_8341_113d90bc-e4ab-4f60-a0ea-9ceb7db683cf.png?v=1773640481&width=480,https://www.cosrx.com/cdn/shop/files/Peptide_132_mini_Kit_02_1024x1024.jpg?v=1773640481,https://www.cosrx.com/cdn/shop/files/Peptide_132_mini_Kit_03_1024x1024.jpg?v=1773640481,https://www.cosrx.com/cdn/shop/files/Peptide_132_17_1024x1024.jpg?v=1774589017,https://www.cosrx.com/cdn/shop/files/Peptide_132_04_Treatment_0f552864-ccf5-40fa-817d-e80960126402_1024x1024.webp?v=1774588896,https://www.cosrx.com/cdn/shop/files/Peptide_132_06_08007346-18d7-4ac5-96b2-45b453760ffb_1024x1024.webp?v=1774588896,https://www.cosrx.com/cdn/shop/files/Peptide_132_08_Shampoo_1024x1024.webp?v=1774588896,https://www.cosrx.com/cdn/shop/files/Peptide_132_07_Treatment_1024x1024.webp?v=1774588896,https://www.cosrx.com/cdn/shop/files/Peptide_132_07_OilSerum_783febd4-652b-48e3-af0e-e6b494754147_1024x1024.webp?v=1774588896,https://www.cosrx.com/cdn/shop/files/Peptide_132_18_89222389-552a-4317-b96c-4f98fe172982_1024x1024.webp?v=1774588957,https://www.cosrx.com/cdn/shop/files/600x750_MO__01_300x.jpg?v=1754049528",,Single / 400mL
PDRN Full Routine Kit,$73.10,"https://www.cosrx.com/cdn/shop/files/04_5PDRN_FullRoutine_Kit_b9cfb81b-2c89-468c-a368-9d240765701f_800x.jpg?v=1775436983,https://www.cosrx.com/cdn/shop/files/600x750_MO__01_300x.jpg?v=1754049528",,280 mL / 9.46 fl oz
PDRN Glass Skin Duo,$35.70,"https://www.cosrx.com/cdn/shop/files/02_5PDRN_GlassSkin_Duo_800x.jpg?v=1775202740,https://www.cosrx.com/cdn/shop/files/600x750_MO__01_300x.jpg?v=1754049528",,100 mL / 3.38 fl oz
PDRN Daily Routine Kit,$60.35,"https://www.cosrx.com/cdn/shop/files/03_5PDRN_DailyRoutine_Kit_bfd28493-a098-4dda-8255-f322aa5c4e7f_800x.jpg?v=1775202843,https://www.cosrx.com/cdn/shop/files/600x750_MO__01_300x.jpg?v=1754049528",,280 mL / 9.46 fl oz
PDRN Premium Routine Kit,$87.55,"https://www.cosrx.com/cdn/shop/files/05_5PDRN_PremiumRoutine_Kit_800x.jpg?v=1775202740,https://www.cosrx.com/cdn/shop/files/600x750_MO__01_300x.jpg?v=1754049528",,9.46 fl.oz / 280ml
All-Day Sun Protection Duo,$39.10,"https://www.cosrx.com/cdn/shop/files/e_-__800x1067_e51c42f1-fbf8-4f2d-987a-20a9d10cdd74_800x.jpg?v=1776761697,https://www.cosrx.com/cdn/shop/files/600x750_MO__01_300x.jpg?v=1754049528",,Jar / 100g
Two in One Poreless Power Liquid,$25.00,"https://www.cosrx.com/cdn/shop/files/two-in-one-poreless-power-liquid-cosrx-official-1_800x.jpg?v=1724835162,https://www.cosrx.com/cdn/shop/files/two-in-one-poreless-power-liquid-cosrx-official-1.jpg?v=1724835162&width=480,https://www.cosrx.com/cdn/shop/files/two-in-one-poreless-power-liquid-cosrx-official-2_1024x1024.jpg?v=1724835164,https://www.cosrx.com/cdn/shop/files/two-in-one-poreless-power-liquid-cosrx-official-3_1024x1024.jpg?v=1724835166,https://www.cosrx.com/cdn/shop/files/two-in-one-poreless-power-liquid-cosrx-official-4_1024x1024.jpg?v=1724835169,https://www.cosrx.com/cdn/shop/files/two-in-one-poreless-power-liquid-cosrx-official-5_1024x1024.jpg?v=1724835171,https://www.cosrx.com/cdn/shop/files/two-in-one-poreless-power-liquid-cosrx-official-6_1024x1024.jpg?v=1724835173,https://www.cosrx.com/cdn/shop/files/600x750_MO__01_300x.jpg?v=1754049528","Salix Alba (Willow) Bark Water, Butylene Glycol, Hydroxypropyl Cyclodextrin, Water, Pentylene Glycol, 1,2-Hexanediol, Betaine Salicylate, Arginine, Betaine, PEG-60 Hydrogenated Castor Oil, Allantoin, Panthenol, Ethylhexylglycerin, Sodium Hyaluronate, Carbomer, Cassia Obtusifolia Seed Extract, Menthyl Lactate, Mentha Haplocalix Extract",Jar / 100g
Double Peptide Firming Duo,$44.20,"https://www.cosrx.com/cdn/shop/files/BluePeptideSerum_peptideSerum_800x.jpg?v=1782717064,https://www.cosrx.com/cdn/shop/files/BluePeptideSerum_peptideSerum.jpg?v=1782717064&width=480,https://www.cosrx.com/cdn/shop/files/600x750_MO__01_300x.jpg?v=1754049528",,Single / 150mL (5.07 fl.oz)
The Blue Peptide Bakuchiol Plump Duo,$49.50,"https://www.cosrx.com/cdn/shop/files/BluePeptideSerum_Cream_800x.jpg?v=1782717004,https://www.cosrx.com/cdn/shop/files/BluePeptideSerum_Cream.jpg?v=1782717004&width=480,https://www.cosrx.com/cdn/shop/files/600x750_MO__01_300x.jpg?v=1754049528",,Jar / 100g
Skin Barrier & Glow Routine Duo,$44.20,"https://www.cosrx.com/cdn/shop/files/BluePeptideSerum_SnailEssence_800x.jpg?v=1782717031,https://www.cosrx.com/cdn/shop/files/BluePeptideSerum_SnailEssence.jpg?v=1782717031&width=480,https://www.cosrx.com/cdn/shop/files/600x750_MO__01_300x.jpg?v=1754049528",,Single / 400mL
COSRX PEPTIDE-132 Ultra Perfect Hair Bonding Shampoo,$21.09,"https://www.cosrx.com/cdn/shop/files/Peptide_132_00_Shampoo_800x.webp?v=1773219196,https://www.cosrx.com/cdn/shop/files/Peptide_132_00_Shampoo.webp?v=1773219196&width=480,https://www.cosrx.com/cdn/shop/files/Peptide_132_mini_Kit_09_1024x1024.webp?v=1773221391,https://www.cosrx.com/cdn/shop/files/Peptide_132_04_Shampoo_21a60ba4-e63c-48ea-b38c-e6e431e79e12_1024x1024.webp?v=1773221391,https://www.cosrx.com/cdn/shop/files/Peptide_132_06_1024x1024.webp?v=1773221391,https://www.cosrx.com/cdn/shop/files/Peptide_132_08_Shampoo_1024x1024.webp?v=1774588896,https://www.cosrx.com/cdn/shop/files/Peptide_132_13_Shampoo_b7c4f61d-c1ed-4586-9383-53a4b21e1aab_1024x1024.webp?v=1773221391,https://www.cosrx.com/cdn/shop/files/Peptide_132_14_Shampoo_58af6794-f376-4cb9-9d61-b7ea88ec08a2_1024x1024.webp?v=1773221391,https://www.cosrx.com/cdn/shop/files/Peptide_132_15_Shampoo_97b441cd-d034-487c-ad7e-10cdf0054ff7_1024x1024.webp?v=1773221391,https://www.cosrx.com/cdn/shop/files/Peptide_132_16_Shampoo_658fd783-e083-4428-8ac0-9bf2bb4e16eb_1024x1024.webp?v=1773221391,https://www.cosrx.com/cdn/shop/files/Peptide_132_17_1024x1024.jpg?v=1774589017,https://www.cosrx.com/cdn/shop/files/Peptide_132_18_1c02f14d-c751-4788-bc90-af4002f2fcc8_1024x1024.webp?v=1774588991,https://www.cosrx.com/cdn/shop/files/Peptide_132_Shampoo_03_400ml_7771cfaa-f0cf-4251-8469-24ee6deb69e8_1024x1024.jpg?v=1774588991,https://www.cosrx.com/cdn/shop/files/Peptide_132_Shampoo_02_200ml_e4de4bd5-bd4a-40b7-a2fc-a652396ab304_1024x1024.jpg?v=1774588991,https://www.cosrx.com/cdn/shop/files/Peptide_132_Shampoo_01_100ml_5ad47732-fbfa-42e0-9670-b33bae200e2d_1024x1024.jpg?v=1774588991,https://www.cosrx.com/cdn/shop/files/Peptide_132_Shampoo_02_200ml_09fca1e8-61f0-4f8c-af3a-0c30b0d0c851_1024x1024.jpg?v=1774588991,https://www.cosrx.com/cdn/shop/files/600x600_Shampoo_Treatment_Oil_1024x1024.jpg?v=1770282596,https://www.cosrx.com/cdn/shop/files/600x600_Oil_Serum_01_1024x1024.jpg?v=1770282597,https://www.cosrx.com/cdn/shop/files/600x600_Shampoo_02_1024x1024.jpg?v=1770282596,https://www.cosrx.com/cdn/shop/files/600x750_MO__01_300x.jpg?v=1754049528","Aqua/Water, Sodium C14-16 Olefin Sulfonate, Glycerin, Disodium Laureth Sulfosuccinate, Cocamidopropyl Betaine, Caprylyl/Capryl Glucoside, Lauryl Hydroxysultaine, Disodium Cocoyl Glutamate, Sodium Cocoyl Alaninate, Lauryl Betaine, Sodium Chloride, Cetyl Alcohol, Polyquaternium-10, Citric Acid, Sodium Salicylate, PVP, Fragrance/Parfum, Caprylyl Glycol, Trihydroxystearin, Caprylic/Capric Triglyceride, Polyquaternium-6, Sodium Citrate, PPG-3 Caprylyl Ether, C10-18 Triglycerides, Vitis Vinifera (Grape) Seed Oil, Dicaprylyl Ether, Sodium Metaphosphate, Ethylhexylglycerin, Piroctone Olamine, Anthemis Nobilis Flower Water, Glyceryl Stearate, Guar Hydroxypropyltrimonium Chloride, Sodium Benzoate, Macadamia Ternifolia Seed Oil, Dehydroacetic Acid, Hexyl Cinnamal, Propanediol, Zinc PCA, 1,2-Hexanediol, Biotin, Tripeptide-132 HCl, Tocopherol, Sodium Hyaluronate, Laminaria Japonica Extract, Avena Sativa (Oat) Peptide, Arginine, Serine, Glutamic Acid, Threonine, Leucine, Proline, Aspartic Acid, Isoleucine, Glycine, Soluble Collagen, Hydrolyzed Hyaluronic Acid, Phenylalanine, Alanine, Tyrosine, Lysine, Sodium Hyaluronate Crosspolymer, Histidine, Hyaluronic Acid, Caffeine, Panthenol, Niacinamide, Alcohol Denat., PEG-150 Pentaerythrityl Tetrastearate, Hydrogenated Lecithin, Butylene Glycol, Cetearyl Alcohol, Valine, PPG-2 Hydroxyethyl Cocamide, Stearic Acid, Sodium Acetylated Hyaluronate, Ceramide NP, Phytosphingosine, Cholesterol, Hydrolyzed Vegetable Protein, Methionine, Ceramide NS, Cystine, Ceramide AP, Ceramide EOP, Tryptophan, Ceramide AS",Single / 400mL
